{
  "exam_id": "retake-practice-10",
  "title": "Unit 2 Retake Practice 10",
  "subtitle": "Consolidation — 3/4-power fractional exponents, multi-base exponentials, extraneous roots",
  "time_minutes": 50,
  "created": "2026-02-22",
  "created_by": "GR",
  "purpose": "Kai scored 14/15 (93%) on RP4 — missed Q11 (fractional-exp W3.b). RP10 escalates Q11 to 3/4 exponent (new exponent type), adds extraneous-check to Q9, and introduces 4-coefficient absolute value function in Q2. All answers unique across RP1-9.",
  "questions": [
    {
      "id": "rp10-q1",
      "number": 1,
      "section": "A",
      "standard": "W2.a",
      "type": "quadratic",
      "question_html": "Solve by factoring: \\( 3x^2 - x - 10 = 0 \\)",
      "inputs": [
        {
          "id": "q1_factored",
          "type": "text",
          "label": "Factored form:"
        },
        {
          "id": "q1_x1",
          "type": "number",
          "label": "Smaller x =",
          "answer": -1.667,
          "tolerance": 0.05
        },
        {
          "id": "q1_x2",
          "type": "number",
          "label": "Larger x =",
          "answer": 2,
          "tolerance": 0.05
        }
      ],
      "hint": "AC method: a×c = 3×(-10) = -30. Find factors of -30 that add to -1.",
      "solution_steps": [
        "a×c = -30. Factors adding to -1: +5 and -6.",
        "Split: 3x² + 5x - 6x - 10.",
        "Group: x(3x+5) - 2(3x+5) = (x-2)(3x+5) = 0.",
        "x=2 or x=-5/3≈-1.667.",
        "Check: 3(4)-2-10=0 ✓, 3(25/9)+5/3-10=0 ✓"
      ],
      "feedback_wrong": "AC: a×c=-30. Factors adding to -1: +5 and -6. Group: (x-2)(3x+5)=0 → x=2 or x=-5/3."
    },
    {
      "id": "rp10-q2",
      "number": 2,
      "section": "A",
      "standard": "W2.b",
      "type": "absolute-value",
      "question_html": "For \\( f(x) = 5|x - 6| - 10 \\): state the vertex, x-intercepts, and range.",
      "inputs": [
        {
          "id": "q2_vx",
          "type": "number",
          "label": "Vertex x =",
          "answer": 6,
          "tolerance": 0.05
        },
        {
          "id": "q2_vy",
          "type": "number",
          "label": "Vertex y =",
          "answer": -10,
          "tolerance": 0.05
        },
        {
          "id": "q2_x1",
          "type": "number",
          "label": "Smaller x-intercept =",
          "answer": 4,
          "tolerance": 0.05
        },
        {
          "id": "q2_x2",
          "type": "number",
          "label": "Larger x-intercept =",
          "answer": 8,
          "tolerance": 0.05
        },
        {
          "id": "q2_range",
          "type": "text",
          "label": "Range (interval notation):"
        }
      ],
      "hint": "a|x-h|+k form. h=6, k=-10. Set f(x)=0 to find x-intercepts.",
      "solution_steps": [
        "f(x) = 5|x-6| + (-10). Vertex: h=6, k=-10 → (6,-10).",
        "x-intercepts: 5|x-6|=10 → |x-6|=2 → x-6=2 or x-6=-2 → x=8 or x=4.",
        "a=5>0 opens upward. Range: [-10, +∞)."
      ],
      "feedback_wrong": "Vertex (6,-10). Set f=0: |x-6|=2 gives x=4 and x=8. Range: [-10,+∞)."
    },
    {
      "id": "rp10-q3",
      "number": 3,
      "section": "A",
      "standard": "W3.a",
      "type": "absolute-value",
      "question_html": "Solve: \\( |3x + 6| - 9 = 0 \\). Write BOTH equations before entering answers.",
      "inputs": [
        {
          "id": "q3_cases",
          "type": "text",
          "label": "Both cases (write them out):"
        },
        {
          "id": "q3_x1",
          "type": "number",
          "label": "Smaller x =",
          "answer": -5,
          "tolerance": 0.05
        },
        {
          "id": "q3_x2",
          "type": "number",
          "label": "Larger x =",
          "answer": 1,
          "tolerance": 0.05
        }
      ],
      "hint": "Isolate: |3x+6|=9. Factor: 3|x+2|=9 → |x+2|=3. Write both cases.",
      "solution_steps": [
        "Isolate: |3x+6| = 9. Factor: 3|x+2|=9 → |x+2|=3.",
        "Case 1: x+2=3 → x=1.",
        "Case 2: x+2=-3 → x=-5.",
        "Check: |3(1)+6|-9=|9|-9=0 ✓, |3(-5)+6|-9=|-9|-9=0 ✓"
      ],
      "feedback_wrong": "Isolate: |3x+6|=9. Factor to 3|x+2|=9 → |x+2|=3 → x=1 or x=-5."
    },
    {
      "id": "rp10-q4",
      "number": 4,
      "section": "B",
      "standard": "W3.d",
      "type": "exponential",
      "question_html": "Solve: \\( 2^{3x-1} = 64 \\)",
      "inputs": [
        {
          "id": "q4_x",
          "type": "number",
          "label": "x =",
          "answer": 2.333,
          "tolerance": 0.05
        }
      ],
      "hint": "Rewrite 64 as a power of 2. Then set exponents equal and solve the linear equation.",
      "solution_steps": [
        "64 = 2^6.",
        "2^(3x-1) = 2^6 → 3x-1=6 → 3x=7 → x=7/3≈2.333.",
        "Check: 2^(3·7/3-1)=2^(7-1)=2^6=64 ✓"
      ],
      "feedback_wrong": "Rewrite 64=2^6. Then 3x-1=6 → 3x=7 → x=7/3≈2.333."
    },
    {
      "id": "rp10-q5",
      "number": 5,
      "section": "B",
      "standard": "W2.a",
      "type": "quadratic",
      "question_html": "Solve by factoring: \\( 3x^2 + 5x - 2 = 0 \\)",
      "inputs": [
        {
          "id": "q5_factored",
          "type": "text",
          "label": "Factored form:"
        },
        {
          "id": "q5_x1",
          "type": "number",
          "label": "Smaller x =",
          "answer": -2,
          "tolerance": 0.05
        },
        {
          "id": "q5_x2",
          "type": "number",
          "label": "Larger x =",
          "answer": 0.333,
          "tolerance": 0.05
        }
      ],
      "hint": "AC method: a×c = 3×(-2) = -6. Find factors of -6 that add to +5.",
      "solution_steps": [
        "a×c = -6. Factors adding to +5: +6 and -1.",
        "Split: 3x² + 6x - x - 2.",
        "Group: 3x(x+2) - 1(x+2) = (3x-1)(x+2) = 0.",
        "x=1/3≈0.333 or x=-2.",
        "Check: 3(1/9)+5/3-2=1/3+5/3-6/3=0 ✓, 3(4)-10-2=0 ✓"
      ],
      "feedback_wrong": "AC: a×c=-6. Factors adding to +5: +6 and -1. Group: (3x-1)(x+2)=0 → x=1/3 or x=-2."
    },
    {
      "id": "rp10-q6",
      "number": 6,
      "section": "B",
      "standard": "W3.c",
      "type": "radical",
      "question_html": "Solve: \\( \\sqrt{x^2 - 40} = 9 \\)",
      "inputs": [
        {
          "id": "q6_x1",
          "type": "number",
          "label": "Smaller x =",
          "answer": -11,
          "tolerance": 0.05
        },
        {
          "id": "q6_x2",
          "type": "number",
          "label": "Larger x =",
          "answer": 11,
          "tolerance": 0.05
        }
      ],
      "hint": "Square both sides. You get x²= a perfect square. That gives two solutions.",
      "solution_steps": [
        "Square both sides: x²-40 = 81 → x² = 121.",
        "x = ±11. Two solutions.",
        "Check: √(121-40)=√81=9 ✓"
      ],
      "feedback_wrong": "Square both sides: x²-40=81 → x²=121 → x=±11."
    },
    {
      "id": "rp10-q7",
      "number": 7,
      "section": "B",
      "standard": "W3.d",
      "type": "exponential",
      "question_html": "Solve: \\( 4^x \\cdot 2^{x+3} = 2^{19} \\)",
      "inputs": [
        {
          "id": "q7_x",
          "type": "number",
          "label": "x =",
          "answer": 5.333,
          "tolerance": 0.05
        }
      ],
      "hint": "Rewrite 4^x as a power of 2. Then add exponents and set equal to 19.",
      "solution_steps": [
        "4^x = (2²)^x = 2^(2x).",
        "2^(2x) · 2^(x+3) = 2^(3x+3).",
        "3x+3=19 → 3x=16 → x=16/3≈5.333.",
        "Check: 2^(32/3)·2^(19/3)=2^(51/3)=2^17 ≠ 2^19... recalc: 3(16/3)+3=16+3=19 ✓"
      ],
      "feedback_wrong": "4^x=2^(2x). Then 2^(2x)·2^(x+3)=2^(3x+3)=2^19 → 3x+3=19 → x=16/3≈5.333."
    },
    {
      "id": "rp10-q8",
      "number": 8,
      "section": "B",
      "standard": "W3.c",
      "type": "rational",
      "question_html": "Solve: \\( \\dfrac{x + 4}{x - 3} = 5 \\)",
      "inputs": [
        {
          "id": "q8_x",
          "type": "number",
          "label": "x =",
          "answer": 4.75,
          "tolerance": 0.05
        }
      ],
      "hint": "Multiply both sides by (x-3).",
      "solution_steps": [
        "x+4 = 5(x-3) = 5x-15.",
        "4+15 = 5x-x → 19=4x → x=19/4=4.75.",
        "Check: (4.75+4)/(4.75-3)=8.75/1.75=5 ✓"
      ],
      "feedback_wrong": "Multiply by (x-3): x+4=5x-15 → 19=4x → x=19/4=4.75."
    },
    {
      "id": "rp10-q9",
      "number": 9,
      "section": "B",
      "standard": "W3.b",
      "type": "radical",
      "question_html": "Solve: \\( \\sqrt{3x - 2} = x - 4 \\). Check for extraneous solutions.",
      "inputs": [
        {
          "id": "q9_x",
          "type": "number",
          "label": "x =",
          "answer": 9,
          "tolerance": 0.05
        }
      ],
      "hint": "Square both sides. You get a quadratic. Solve and check BOTH roots.",
      "solution_steps": [
        "Square: 3x-2 = (x-4)² = x²-8x+16.",
        "x²-11x+18 = 0 → (x-9)(x-2) = 0.",
        "x=9 or x=2. Check both:",
        "x=9: √(27-2)=√25=5 and 9-4=5 ✓.",
        "x=2: √(4)=2 and 2-4=-2. 2≠-2, so x=2 is extraneous.",
        "Answer: x=9."
      ],
      "feedback_wrong": "Square: x²-11x+18=0 → (x-9)(x-2)=0. Check: x=2 is extraneous (√4=2 ≠ 2-4=-2). Answer: x=9."
    },
    {
      "id": "rp10-q10",
      "number": 10,
      "section": "B",
      "standard": "W3.d",
      "type": "exponential",
      "question_html": "Solve: \\( 2^{x^2 + 3} = 1024 \\)",
      "inputs": [
        {
          "id": "q10_x1",
          "type": "number",
          "label": "Smaller x =",
          "answer": -2.646,
          "tolerance": 0.05
        },
        {
          "id": "q10_x2",
          "type": "number",
          "label": "Larger x =",
          "answer": 2.646,
          "tolerance": 0.05
        }
      ],
      "hint": "Rewrite 1024 as a power of 2. Then solve x²+3= that exponent. Two solutions.",
      "solution_steps": [
        "1024 = 2^10.",
        "x²+3=10 → x²=7.",
        "x=±√7≈±2.646. Two solutions.",